{
  "$schema": "https://json-schema.org/draft/2020-12/schema",
  "$id": "https://claude-skills/pptx-diagram/schemas/dataflow.schema.json",
  "title": "Native PPTX Dataflow Diagram",
  "description": "Nodes sit in a stage (column, left-to-right) x row (0-4) grid. Flows carry a mandatory label plus an optional classification (e.g. 'PII touch', 'non-PII') for sensitivity/lineage annotations.",
  "type": "object",
  "additionalProperties": false,
  "required": ["schema_version", "diagram_type", "meta", "stages", "nodes", "flows"],
  "properties": {
    "schema_version": { "const": 1 },
    "diagram_type": { "const": "dataflow" },
    "meta": {
      "type": "object",
      "additionalProperties": false,
      "required": ["title"],
      "properties": {
        "title": { "type": "string", "minLength": 1 },
        "subtitle": { "type": "string" },
        "output": { "type": "string" }
      }
    },
    "stages": {
      "type": "array",
      "minItems": 2,
      "maxItems": 5,
      "items": {
        "type": "object",
        "additionalProperties": false,
        "required": ["label"],
        "properties": { "label": { "type": "string", "minLength": 1 } }
      }
    },
    "nodes": {
      "type": "array",
      "minItems": 1,
      "items": {
        "type": "object",
        "additionalProperties": false,
        "required": ["id", "type", "label", "stage", "row"],
        "properties": {
          "id": { "$ref": "common.schema.json#/$defs/id" },
          "type": { "$ref": "common.schema.json#/$defs/nodeType" },
          "label": { "type": "string", "minLength": 1 },
          "sublabel": { "type": "string" },
          "tag": { "type": "string" },
          "stage": { "type": "integer", "minimum": 0, "maximum": 4 },
          "row": { "type": "integer", "minimum": 0, "maximum": 4 }
        }
      }
    },
    "flows": {
      "type": "array",
      "items": {
        "type": "object",
        "additionalProperties": false,
        "required": ["from", "to", "label"],
        "properties": {
          "from": { "$ref": "common.schema.json#/$defs/id" },
          "to": { "$ref": "common.schema.json#/$defs/id" },
          "label": { "type": "string", "minLength": 1 },
          "classification": { "type": "string" },
          "variant": { "enum": ["default", "emphasis", "security", "dashed"] }
        }
      }
    },
    "cards": {
      "type": "array",
      "items": {
        "type": "object",
        "additionalProperties": false,
        "required": ["title", "items"],
        "properties": {
          "title": { "type": "string", "minLength": 1 },
          "color": { "$ref": "common.schema.json#/$defs/hexColor" },
          "items": { "type": "array", "items": { "type": "string" } }
        }
      }
    }
  }
}
